{
  "$schema": "https://json-schema.org/draft/2020-12/schema",
  "$id": "https://dimenticato.xyz/docs/reading-article.schema.json",
  "type": "object",
  "required": [
    "schema",
    "id",
    "storyId",
    "lang",
    "date",
    "title",
    "titleZh",
    "summaryZh",
    "level",
    "levelReason",
    "source",
    "license",
    "attribution",
    "adaptation",
    "sentences",
    "category",
    "topics"
  ],
  "properties": {
    "schema": {
      "const": 1
    },
    "id": {
      "type": "string",
      "pattern": "^[a-z0-9-]+$"
    },
    "storyId": {
      "type": "string",
      "minLength": 1
    },
    "lang": {
      "enum": [
        "it",
        "fr",
        "de",
        "en"
      ]
    },
    "date": {
      "type": "string",
      "format": "date"
    },
    "title": {
      "type": "string",
      "minLength": 1
    },
    "titleZh": {
      "type": "string",
      "minLength": 1
    },
    "summaryZh": {
      "type": "string",
      "minLength": 1
    },
    "level": {
      "enum": [
        "A1",
        "A2",
        "B1",
        "B2",
        "C1",
        "C2"
      ]
    },
    "levelReason": {
      "type": "string",
      "minLength": 1
    },
    "source": {
      "type": "object",
      "required": [
        "name",
        "title",
        "url",
        "publishedAt",
        "lang"
      ],
      "properties": {
        "name": {
          "type": "string",
          "minLength": 1
        },
        "title": {
          "type": "string",
          "minLength": 1
        },
        "url": {
          "type": "string",
          "minLength": 1
        },
        "publishedAt": {
          "type": "string",
          "minLength": 1
        },
        "lang": {
          "type": "string",
          "minLength": 1
        }
      }
    },
    "license": {
      "type": "object",
      "required": [
        "name",
        "url"
      ],
      "properties": {
        "name": {
          "type": "string"
        },
        "url": {
          "type": "string",
          "format": "uri"
        }
      }
    },
    "attribution": {
      "type": "string",
      "minLength": 1
    },
    "adaptation": {
      "type": "string",
      "minLength": 1
    },
    "sentences": {
      "type": "array",
      "minItems": 1,
      "items": {
        "type": "object",
        "required": [
          "id",
          "text",
          "zh",
          "glosses"
        ],
        "properties": {
          "id": {
            "type": "string"
          },
          "text": {
            "type": "string",
            "minLength": 1
          },
          "zh": {
            "type": "string",
            "minLength": 1
          },
          "glosses": {
            "type": "array",
            "items": {
              "type": "object",
              "required": [
                "surface",
                "lemma",
                "zh"
              ],
              "properties": {
                "surface": {
                  "type": "string"
                },
                "lemma": {
                  "type": "string"
                },
                "zh": {
                  "type": "string"
                },
                "note": {
                  "type": "string"
                }
              }
            }
          }
        }
      }
    },
    "contentType": {
      "enum": [
        "native-adaptation",
        "original-learning"
      ]
    },
    "learningSummary": {
      "type": "object",
      "required": [
        "words",
        "phrases",
        "sentences"
      ],
      "properties": {
        "words": {
          "type": "array",
          "minItems": 1,
          "items": {
            "type": "object",
            "required": [
              "text",
              "zh",
              "sentenceId"
            ],
            "properties": {
              "text": {
                "type": "string",
                "minLength": 1
              },
              "zh": {
                "type": "string",
                "minLength": 1
              },
              "sentenceId": {
                "type": "string",
                "minLength": 1
              },
              "lemma": {
                "type": "string",
                "minLength": 1
              },
              "note": {
                "type": "string",
                "minLength": 1
              }
            }
          }
        },
        "phrases": {
          "type": "array",
          "minItems": 1,
          "items": {
            "type": "object",
            "required": [
              "text",
              "zh",
              "sentenceId"
            ],
            "properties": {
              "text": {
                "type": "string",
                "minLength": 1
              },
              "zh": {
                "type": "string",
                "minLength": 1
              },
              "sentenceId": {
                "type": "string",
                "minLength": 1
              },
              "lemma": {
                "type": "string",
                "minLength": 1
              },
              "note": {
                "type": "string",
                "minLength": 1
              }
            }
          }
        },
        "sentences": {
          "type": "array",
          "minItems": 1,
          "items": {
            "type": "object",
            "required": [
              "sentenceId",
              "note"
            ],
            "properties": {
              "sentenceId": {
                "type": "string",
                "minLength": 1
              },
              "note": {
                "type": "string",
                "minLength": 1
              }
            }
          }
        }
      }
    },
    "category": {
      "enum": [
        "technology",
        "society",
        "culture",
        "environment",
        "education",
        "work-economy",
        "health"
      ]
    },
    "topics": {
      "type": "array",
      "minItems": 1,
      "maxItems": 5,
      "uniqueItems": true,
      "items": {
        "type": "string",
        "minLength": 1,
        "maxLength": 40
      }
    },
    "speaking": {
      "type": "object",
      "required": [
        "questions"
      ],
      "properties": {
        "questions": {
          "type": "array",
          "minItems": 1,
          "maxItems": 3,
          "items": {
            "type": "object",
            "required": [
              "text",
              "zh"
            ],
            "properties": {
              "text": {
                "type": "string",
                "minLength": 1
              },
              "zh": {
                "type": "string",
                "minLength": 1
              },
              "note": {
                "type": "string",
                "minLength": 1
              },
              "sentenceId": {
                "type": "string",
                "minLength": 1
              }
            }
          }
        },
        "expressions": {
          "type": "array",
          "minItems": 1,
          "maxItems": 5,
          "items": {
            "type": "object",
            "required": [
              "text",
              "zh"
            ],
            "properties": {
              "text": {
                "type": "string",
                "minLength": 1
              },
              "zh": {
                "type": "string",
                "minLength": 1
              },
              "note": {
                "type": "string",
                "minLength": 1
              },
              "sentenceId": {
                "type": "string",
                "minLength": 1
              }
            }
          }
        }
      }
    }
  },
  "allOf": [
    {
      "if": {
        "required": [
          "contentType"
        ]
      },
      "then": {
        "required": [
          "learningSummary"
        ]
      }
    }
  ]
}
